{"ahtml":"0.1","url":"https://app.example.com/board","fetched_at":"2026-01-01T00:00:00.000Z","page_type":"task_list","entities":[{"id":"task:t-1","type":"task","title":"Ship 1.1","state":"in_progress","priority":"high","labels":["release"]},{"id":"profile:roy","type":"profile","name":"Roy","kind":"person","handle":"@roy","verified":true},{"id":"dataset:sales","type":"dataset","name":"Q1 Sales","columns":[{"key":"date","label":"Date","type":"datetime"}],"rows":[["2026-01-01"]],"row_count_total":90},{"id":"conversation:thread-1","type":"conversation","participants":["profile:roy"],"messages":[{"id":"m1","author":"profile:roy","posted_at":"2026-01-01T00:00:00.000Z","content":"hi"}],"title":"Support","message_count_total":1}],"actions":[]}