{"ahtml":"0.1","url":"https://corpus.example.com/p/widget","fetched_at":"2026-01-01T00:00:00.000Z","ttl":300,"etag":"W/\"corpus-1\"","page_type":"product_detail","policy":{"agents_welcome":true,"license":"MIT","rate_limit":"100/min"},"entities":[{"id":"product:widget","type":"product","name":"Corpus Widget — “canonical” ünicode ✓","brand":"Corpus","price":{"amount":19.99,"currency":"USD"},"stock":{"status":"in_stock","quantity":7},"rating":{"average":4.2,"count":37}}],"actions":[{"id":"purchase","category":"transact","target":"product:widget","method":"POST","execute_url":"/api/checkout","auth":"required","cost":{"category":"purchase","amount":19.99,"currency":"USD"},"reversible":{"reversible":true,"window":"P30D","policy":"full_refund"},"side_effects":["charge_card"],"confirmation":"required"}]}