{"ahtml":"0.1","url":"https://shop.example.com/p/mbp-14-m3","fetched_at":"2026-01-01T00:00:00.000Z","ttl":300,"etag":"W/\"f4c2\"","page_type":"product_detail","policy":{"agents_welcome":true,"license":"MIT","rate_limit":"100/min","contact":"agents@shop.example.com"},"provenance":{"issuer":"did:web:shop.example.com","signed":false},"entities":[{"id":"product:mbp-14-m3","type":"product","name":"MacBook Pro 14\" M3","brand":"Apple","price":{"amount":1999,"currency":"USD"},"list_price":{"amount":2199,"currency":"USD"},"stock":{"status":"in_stock","quantity":42},"rating":{"average":4.7,"count":1284},"sku":"MBP14-M3-512-SB"}],"actions":[{"id":"purchase","label":"Buy now","target":"product:mbp-14-m3","category":"transact","method":"POST","execute_url":"/api/checkout","auth":"required","cost":{"amount":1999,"currency":"USD","category":"purchase"},"reversible":{"reversible":true,"window":"P30D","policy":"full_refund"},"side_effects":["charge_card","email_buyer","decrement_stock"],"confirmation":"required"}]}