{"ahtml":"0.1","url":"https://example.com/i18n","fetched_at":"2026-01-01T00:00:00.000Z","page_type":"document","entities":[{"id":"document:i18n","type":"document","title":"café — 日本語 — العربية — 🚀 \"quoted\" \\backslash\\","summary":"Ünïcödé edge cases:\ttab, newline handling, and — em dash."}],"actions":[]}