{"ahtml":"0.1","url":"https://corpus.example.com/p/widget","fetched_at":"2026-01-01T00:00:00.000Z","ttl":300,"etag":"W/\"corpus-2\"","page_type":"product_detail","policy":{"agents_welcome":true,"license":"MIT","rate_limit":"100/min"},"entities":[{"id":"product:widget","type":"product","name":"Corpus Widget — “canonical” ünicode ✓","brand":"Corpus","price":{"amount":17.99,"currency":"USD"},"stock":{"status":"low_stock","quantity":2},"rating":{"average":4.2,"count":37}}],"actions":[]}