{"ahtml":"0.1","url":"https://blog.example.com/essay","fetched_at":"2026-01-01T00:00:00.000Z","page_type":"document","entities":[{"id":"document:essay-1","type":"document","title":"Why Agents Need AHTML","author":"Dibbayajyoti Roy","published_at":"2026-05-12T00:00:00.000Z","summary":"A short argument.","word_count":184,"language":"en","tags":["agents","web"]}],"actions":[]}